<?xml version="1.0" encoding="UTF-8"?>
<BALANCEENQUIRYRESPONSE xmlns:tns="http://www.ibm.com/dfdl/CobolDataDefinitionFormat" xmlns:xsi="http://www.w3.org/2001/XMLSchema-instance" xsi:noNamespaceSchemaLocation="../../ZB_Enq0001/Balance_Enquiry_Response.xsd">
  <DUMMY001_138> </DUMMY001_138>
  <PCREF> </PCREF>
  <DUMMY002_221> </DUMMY002_221>
  <OVERDRAFTLIMIT> </OVERDRAFTLIMIT>
  <DUMMY003_007> </DUMMY003_007>
  <OVERDRAFTEXPIRED> </OVERDRAFTEXPIRED>
  <RESERVEDBALANCE> </RESERVEDBALANCE>
  <CLOSINGBALANCE> </CLOSINGBALANCE>
  <STATUSBAL> </STATUSBAL>
  <DUMMY004_032> </DUMMY004_032>
  <AVAILABLEBALANCE> </AVAILABLEBALANCE>
  <DUMMY005_100> </DUMMY005_100>
  <SUM1> </SUM1>
  <SUM2> </SUM2>
  <SHADOWDEBITS> </SHADOWDEBITS>
  <SHADOWCREDITS> </SHADOWCREDITS>
  <DUMMY006_098> </DUMMY006_098>
</BALANCEENQUIRYRESPONSE>
